{
  "$schema": "https://json-schema.org/draft/2020-12/schema",
  "$id": "https://agentoffernetwork.org/schema/offer-provider-request/v0.1",
  "title": "AgentOffer OfferProvider Request Schema v0.1",
  "description": "Request body that AON sends to a Partner's OfferProvider endpoint (POST {base_url}/v1/offers/query). This Partner-facing payload is derived from Query context, intent, and supply-side constraints for AON-to-Partner dispatch. Uses RFC 2119 requirement levels (REQUIRED/RECOMMENDED/OPTIONAL).",
  "type": "object",
  "required": [
    "request_id",
    "context",
    "intent"
  ],
  "properties": {
    "request_id": {
      "type": "string",
      "description": "Unique request identifier. UUIDv7 recommended. REQUIRED on the AON → Partner channel: AON always generates and sends one so Partner logs / replay protection / billing reconciliation can correlate every dispatch. Partner MAY echo it back in headers (`X-AON-Request-Id`) and logs.",
      "format": "uuid"
    },
    "timestamp": {
      "type": "string",
      "format": "date-time",
      "description": "RFC 3339 timestamp of the request. Set by AON at dispatch time."
    },
    "test_mode": {
      "type": "boolean",
      "description": "When true, the request is a test and Partner SHOULD NOT generate real tracking or billing events. The authoritative test-mode signal is the X-AON-Test HTTP header; this body field is retained for protocol parity with OfferQueryRequest.",
      "default": false
    },
    "context": {
      "type": "object",
      "description": "Contextual information about the requesting platform, session, and user.",
      "required": [
        "user_profile"
      ],
      "properties": {
        "platform": {
          "type": "object",
          "description": "Information about the requesting platform or agent.",
          "properties": {
            "name": {
              "type": "string"
            },
            "version": {
              "type": "string"
            },
            "channel": {
              "type": "string"
            }
          },
          "additionalProperties": false
        },
        "session_id": {
          "type": "string"
        },
        "conversation_id": {
          "type": [
            "string",
            "number"
          ],
          "description": "Conversation or thread identifier within the session."
        },
        "user_profile": {
          "type": "object",
          "description": "User profile information for intent matching and targeting.",
          "properties": {
            "user_pseudo_id": {
              "type": "string"
            },
            "language": {
              "type": "string"
            },
            "interests": {
              "type": "array",
              "items": {
                "type": "string"
              }
            },
            "device_info": {
              "type": "object",
              "properties": {
                "device_type": {
                  "type": "string"
                },
                "os": {
                  "type": "string"
                },
                "os_version": {
                  "type": "string"
                },
                "user_agent": {
                  "type": "string",
                  "maxLength": 1024,
                  "description": "Optional raw or normalized end-user user-agent string for diagnostics and compatibility. Do not use as a stable identifier."
                }
              },
              "additionalProperties": false
            }
          },
          "additionalProperties": false
        }
      },
      "additionalProperties": false
    },
    "intent": {
      "type": "object",
      "description": "The user's intent expressed as multimodal content.",
      "required": [
        "content"
      ],
      "properties": {
        "content": {
          "type": "array",
          "minItems": 1,
          "items": {
            "type": "object",
            "required": [
              "type"
            ],
            "properties": {
              "type": {
                "type": "string",
                "enum": [
                  "input_text",
                  "input_image"
                ]
              },
              "text": {
                "type": "string"
              },
              "image_url": {
                "type": "string",
                "format": "uri"
              }
            },
            "additionalProperties": false
          }
        }
      },
      "additionalProperties": false
    },
    "constraints": {
      "type": "object",
      "description": "Partner-facing supply-side constraints applied by the Partner before returning eligible offers. Category constraints use AON Taxonomy v1 category_ids.",
      "properties": {
        "category_ids": {
          "type": "array",
          "items": {
            "type": "string",
            "pattern": "^[a-z0-9]+(?:_[a-z0-9]+)*(?:\\.[a-z0-9]+(?:_[a-z0-9]+)*)*$"
          },
          "description": "Constrain by AON Taxonomy v1 category id. OR logic within the array; each id matches the selected taxonomy node and all descendants. Registry membership is validated by the taxonomy drift guard."
        }
      },
      "additionalProperties": false
    },
    "pagination": {
      "type": "object",
      "properties": {
        "limit": {
          "type": "integer",
          "minimum": 1,
          "maximum": 100,
          "default": 20
        },
        "offset": {
          "type": "integer",
          "minimum": 0,
          "default": 0
        }
      },
      "additionalProperties": false
    }
  },
  "additionalProperties": false
}
